,headline,is_sarcastic
1543,Poll Finds 97% Of Americans Don’t Know Who Donald Trump Is,1
1544,Kavanaugh Nomination Falters After Washington Post Publishes Shocking Editorial Claiming He Forgot Daughter’s Piano Recital,1
1545,Peter Strzok Summoned Before Congress Again For Texts Calling Trey Gowdy ‘A Pissy Little Shithead’,1
1546,Stressed-Out Paul Ryan Uses Cheat Day To Indulge In One Bipartisan Vote,1
1547,Tearful Trump Admits NATO Alliance Closest Thing To Friendship He’s Ever Had,1
1548,Trump Demands NATO Allies Match U.S. Commitment To Prioritizing Military Spending Over Healthcare,1
1549,How Will Justice Kennedy’s Retirement Affect The Supreme Court?,1
1550,Everything You Need To Know About The Supreme Court Upholding Trump's Travel Ban,1
1551,Exasperated Huckabee Sanders Reminds Press Corps That Children Under 14 Can’t Feel Pain,1
1552,Political Scientists Baffled By Trump’s Ability To End Something He Had No Control Over Just Days Ago,1
1553,Stephen Miller Furious At ProPublica For Only Releasing 7-Minute Recording Of Immigrant Children Sobbing,1
1554,Jeff Sessions Argues Family Separations Only Happening Because Current Law Doesn’t Allow Him To Strangle Immigrants With Bare Hands,1
1555,Laura Bush Publishes Courageous Op-Ed Calling For Imprisonment Of Whoever Created ICE,1
1556,Sessions Defends Separating Immigrant Families By Citing Senate Confirmation Vote,1
1557,President’s Lawyers Move To Discredit Michael Cohen By Pointing Out History Of Committing Crimes For Trump,1
1558,Kid Who Mowed White House Lawn To Flip On Trump,1
1559,Trump Touts Success Of Singapore Summit After Securing $10 Billion Trade Deal To Sell Nuclear Warheads To North Korea,1
1560,World Leaders Hope Singapore Summit Will Lead To North Korea Becoming Normal Impoverished Country They Don’t Have To Think About,1
1561,Giuliani Says Kim Jong-Un Begged Like A Has-Been-Politician-Turned-Hack-Attorney Trying To Get A Job At The White House,1
1562,Scott Pruitt Claims Misappropriated EPA Funds Would Have Only Been Wasted On Dumb Shit Like Clean Water,1
1563,Bill Clinton Still Waiting For Personal Apology From Monica Lewinsky For Using Power As Intern To Exploit Him Sexually,1
1564,Bill Clinton Admits That Knowing What He Knows Now He Would Have Still Preyed On Women,1
1565,Rudy Giuliani Lays Out Legal Framework That Would Keep Him On TV For Next Couple Years,1
1566,Supreme Court Rules Gay Rights Do Not Extend To Dessert,1
1567,Timeline Of The Republican Party,1
1568,Pollster Informs George H.W. Bush That Dying So Soon After Wife Would Really Boost Favorability Rating,1
1569,Devin Nunes Receives $4.5 Million From Donor On Condition He’ll Just Retire On It And Never Show His Face Again,1
1570,Other 193 Countries Begin Insulting Mike Pence In Hopes Of Avoiding Future Meetings With Trump,1
1571,Jared Kushner Excited To Finally Visit White House After Gaining Security Clearance,1
1572,Senate Intelligence Committee Confirms From Testimony That Donald Trump Jr. Has No Knowledge,1
1573,The Russian Probe: Year One Of Robert Mueller Somehow Resisting The Urge To Gouge Out His Own Eyes,1
1574,Supreme Court Votes 7-2 To Legalize All Worldly Vices,1
1575,Trump Fascinated By Israeli Cultural Tradition Of Mass Slaughter Of Protesters,1
1576,AT&T CEO Regrets Hiring Cohen Instead Of Just Dropping A Ton Of Cash At Trump International Hotel Like Everyone Else,1
1577,The Pros And Cons Of Civility In Politics,1
1578,New Don Blankenship Campaign Ad Touts Jobs Created In Wake Of Upper Big Branch Mining Disaster,1
1579,"‘I Was The One Who Slept With Stormy Daniels,’ Says Sonny Perdue In Desperate Attempt To Serve As Trump’s Fall Guy",1
1580,NY Gubernatorial Race: Andrew Cuomo vs. Cynthia Nixon,1
1581,Russian Lawyer Admits To Repeatedly Informing Kremlin Of Trump Campaign’s Ineptitude,1
1582,Timeline Of The White House Correspondents’ Dinner,1
1583,Pence Unveils Campaign To Educate Teens About Dangers Of Premarital Eye Contact,1
1584,Trump Boys Beg Father To Nominate G.I. Joe Action Figure Cobra Commander For VA Secretary,1
1585,"Trump Suffering Horrible Indigestion After Eating Fresh, Well-Prepared State Dinner Meal",1
1586,"Emmanuel Macron Amused By Little Differences In French, American Islamophobia",1
1587,Most Shocking Revelations Of The Comey Memos,1
1588,"DNC Files Lawsuit Alleging Nation Should Never, Ever Stop Focusing On 2016 Election",1
1589,Mike Pompeo Defects To North Korea After Learning About Kim Jong-Un’s Torture Program,1
1590,Nation’s Liberals Not Sure What To Think After Hearing Special Counsel Has Waterboarded Every Suspect In Trump Investigation,1
1591,Congress Not Sure What It Did To Make Trump Think It Wouldn’t Roll Over For Whatever He Wants In Syria,1
1592,"Hannity Claims Relationship With Cohen Never Went Past Payment For Legal Advice, Defense Strategy In Criminal Cases",1
1593,Biggest Revelations From James Comey’s New Book,1
1594,U.S. Won’t Rule Out Escalating Defense-Sector Profits From Syria Conflict,1
1595,Comey Suddenly Realizes Entire Book Just A Subconscious Defense Mechanism To Hide His True Feelings,1
1596,Nation Confused After James Comey Dedicates Entire Memoir To In-Depth Retelling Of Martha Stewart Insider Trading Controversy,1
1597,Mike Pompeo Can’t Believe Senate Just Expects He’ll Answer Questions Without Being Tortured First,1
1598,"‘Look, Just Tell Us Who To Kill,’ Snaps U.S. General As Trump Enters 20th Minute Of Rambling Answer On Syria",1
1599,Aides Trying To Talk Trump Out Of Sending Associates To Break Into Watergate Office Complex ,1
1600,Congress Reassures Nervous Zuckerberg They Won’t Actually Do Anything About This,1
1601,Mark Zuckerberg Apologizes To Congress For Not Realizing Scope Of His Genius,1
1602,Congress Demands To Know How Facebook Got People To Give Up Their Civil Liberties Without A Fight,1
1603,Blood Drains From Mueller’s Face After Realizing Russia Investigation Might Go All The Way To White House,1
1604,"FBI Raids Michael Cohen’s Office To Get Closer Look At His Innovative, Thorough Legal Work",1
1605,John Bolton Arrives In Office Excited To See So Many Familiar Wars,1
1606,"Study Reveals 93% Of Americans Don’t Know Their Congressperson Truly, Utterly, The Way Only Two Souls Entwined Can",1
1607,EPA Rolls Back Emissions Standards To Increase Consumer Choice Over Type Of Apocalyptic Hellscape Earth Will Become,1
1608,Man Who Never Missed ‘Ally McBeal’ Back In The Day Joins Trump Legal Team,1
1609,John Bolton Warns War With North Korea Won’t Be Cakewalk Like Iraq,1
1610,Key 2018 Election Primaries To Watch,1
1611,Rick Perry Apologizes For Trying To Outdo Fellow Cabinet Members By Using $72 Million Of Taxpayer Funds On Lampshade,1
1612,"Donald Trump Jr. Divorce Leaves Confused, Heartbroken Nation Wondering Why Bad Things Happen To Good People",1
1613,Subpoenaed Trump Organization Financial Documents Reveal Company’s Only Holding Is Single Dairy Queen In New Jersey,1
1614,Exhausted Mueller Trying To Find Trump Organization Russia Documents Amid Thousands Of Harassment Lawsuits,1
1615,Gina Haspel Recalls Having To Torture More Prisoners Than Male Colleagues To Prove Herself,1
1616,Secretary Of State Fired After Inappropriately Weighing In On International Politics,1
1617,Betsy DeVos Argues Issue Of Guns In Schools Should Be Fully Left Up To Individual Shooters,1
1618,Wilbur Ross Shakes Self Awake After Briefly Dying During Cabinet Meeting,1
1619,Dozens Of Other Countries That Interfered In 2016 Election Annoyed Russia Getting All The Credit,1
1620,"Huckabee Sanders Warns Stormy Daniels’ Disclosures Just Steamy, Sexy Distraction From Real Issues",1
1621,Idea Of Doing Nothing Until Next Mass Shooting Quickly Gaining Traction In Congress,1
1622,Marco Rubio Still Rock-Hard Days After Being Publicly Humiliated On National Stage,1
1623,"‘Oh God, What Happened Last Night?’ Says Groggy Mike Pence After Waking Up In Same Bed As Wife",1
1624,Veteran Congressman Can Still Remember When Inaction On Gun Violence Actually Presented A Moral Dilemma,1
1625,John Kelly Apologizes For Assuming Everyone Would Ignore Abuse Allegations Like They Do In Military,1
1626,Congress Confused By $500 Million In Trump’s Budget Allocated For ‘Laser Stuff’,1
1627,Trump Announces Plan To Replace Food Stamps With New Low-Income Foraging Program,1
1628,Frustrated Hope Hicks Wishing She Could Find One Nice Guy In This Autocratic Personality Cult,1
1629,Report: Russia Managed To Penetrate Voter Databases In Order To Ensure Election Was Fair And Free Like The Loyal Allies They Are,1
1630,Congress Puts Aside Partisan Differences For Good Of Military Contractors,1
1631,Scott Pruitt Orders EPA Employees To Stay In Office Over Weekend While It’s Being Fumigated,1
1632,Guantánamo Inmates Cheer After Learning Trump Saved Their Home,1
1633,"FBI Warns Republican Memo Could Undermine Faith In Massive, Unaccountable Government Secret Agencies",1
1634,Lawyers Confirm Trump Willing To Answer All Of Sean Hannity’s Questions About Russia Collusion,1
1635,"‘We Must Restore Rule Of Law,’ Says Trump As Aides Pass Out Revolvers To Audience",1
1636,Senator Dick Durbin Forced To Watch State Of The Union Address From Home After Getting Ripped Off By Ticket Scalper,1
1637,Stephen Miller Rewards Self After Day Of Speechwriting With Trip To See Children In Local ICE Detention Center,1
1638,Poll Finds 78% Of Americans Would Vote For Liberty Bell,1
1639,"Trump Insists He Never Thought About Firing Mueller, Feeding Him To Pack Of Rabid Dogs, Mounting Head In Oval Office As Trophy",1
1640,"Cory Booker, Kamala Harris, Elizabeth Warren Assure Dreamers They’ll Never Stop Fighting For The 2020 Nomination",1
1641,Follow-Up Tests Confirm President Trump’s 19 Other Personalities Also Perfectly Healthy,1
1642,Huckabee Sanders Repeatedly Insists That President’s Footprints Created The Great Lakes,1
1643,"New Report Finds Adult Film Star May Have Paid Over $130,000 To Cover Up Sexual Encounter With Trump",1
1644,Paul Ryan Confident American People Will Warm Up To Tax Plan Once They Realize Life A Cruel And Meaningless Farce,1
1645,GOP Leaders Celebrate Decisive Win Over Americans,1
1646,Report: GOP Tax Bill Supported By Majority Of Americans Currently Suffocating Wealthy Benefactor With Pillow,1
1647,DNC Takes Out Full-Page Ad Thanking Alabama’s Working-Class White Voters,1
1648,Baffled DNC Plant Roy Moore Not Sure What Else He Could Have Done To Defame Republican Party,1
1649,Trump Dismisses Accusers As Women,1
1650,New GOP Tax Plan Requires Welfare Recipients To Apply For Each Individual Piece Of Food,1
1651,Al Franken: ‘I’m Deeply Sorry For My Hilarious Actions’,1
1652,"Trump Promises U.S. Will Continue To Recognize, Preserve Palestinians' Historic Refugee Camps",1
1653,Ryan Zinke Comes Out In Support Of Controversial Wildfire,1
1654,"New RNC Ad Endorses Roy Moore: ‘He’s A Scumbag, But He’s Our Scumbag’",1
1655,"Flynn Pleads Guilty To Lying To FBI, But, Worst Of All, Lying To Himself",1
1656,Speeding Democratic Campaign Buses Run Over 173 Iowans In Mad Dash To Get Fuck Out Of State,1
1657,DNC Offers Startup $500 Million To Develop Pencil That Can Accurately Record Election Results,1
1658,DNC Blames Iowa Caucus Problems On Single Fuck-Up Senior Citizen Volunteer,1
1659,Buttigieg: ‘My Record During My First Term As President Speaks For Itself’,1
1660,DNC Mulls Asking Donald Trump To Run As Democrat In Effort To Stop Sanders,1
1661,Report: Fighting Rising Tide Of Authoritarianism Sounds Like A Lot Of Work,1
1662,"‘You’re A Piece Of Shit And I Hope Everyone Like You Dies,’ Says Biden To Democratic Voter In Stirring Call For Party Unity",1
1663,The Onion’s Guide To The 2020 Democratic Candidates,1
1664,Kushner Promises Israel Plan Will Relocate All Palestinians To Generous Swath Of Mediterranean Sea,1
1665,Sanders Unveils Job-Training Program To Provide Meaningful Work To Low-Skilled Op-Ed Writers,1
1666,Chris Matthews Warns Bernie Sanders Victory Runs Risk Of Making Him Look Stupid 2 Elections In A Row,1
1667,Joni Ernst Insists She Hasn’t Seen Any Impeachment Evidence That Has Changed Her Self-Serving Political Calculus,1
1668,Key Players In Trump’s Impeachment Trial,1
1669,CBS Inks Deal For 30-Episode Bloomberg Ad,1
1670,Bolton Pledges To Donate All Proceeds From Book Towards Killing Iranians,1
1671,Amy Klobuchar Enters 18th Minute Of Tense Standoff With Iowa Rally Crowd Who Haven’t Laughed At Her Joke,1
1672,Mike Pompeo: ‘There Is Overwhelming And Undeniable Evidence To Support Going To War With Whoever’,1
1673,Liberals Say Sanders’s Acceptance Of Rogan Endorsement Sends Dangerous Message He Trying To Win Election,1
1674,Melting Giraffe Congressman Warns Impeachment Distracting From Surreal Issues,1
1675,Trump Makes Powerful Pro-Life Case By Speaking About The Joys Of Neglecting A Child,1
1676,Justice Roberts Sternly Admonishes Impeachment Participants To Remember They’re At Complete Farce Of A Trial,1
1677,Senate Republicans Force Through Resolution Establishing Wingstop As Official Sponsor Of Impeachment Trial,1
1678,Contrarian ‘New York Times’ Travel Section Breaks With Paper To Endorse Deval Patrick For Democratic Nomination,1
1679,Kellyanne Conway Suggests Martin Luther King Jr. Would Have Traveled To Ukraine For Dirt On Biden,1
1680,"‘They Can’t Impeach Someone They Can’t See,’ Say Trump Boys Cramming Dad Into Homemade Bunker Under Oval Office Desk",1
1681,Republican Senators Maintain They’ll Weigh All Evidence Before Carrying Trump Out On Shoulders,1
1682,CNN Reveals Bernie Sanders Running For President Of Country With History Of Sexism,1
1683,Stephen Miller Hurt At Being Passed Over For Job Stalking Female Ambassador,1
1684,CNN Audio Analysis Reveals Biden Caught On Wet Mic While Chewing On Own Microphone,1
1685,Public Disapproval Of Iran Approach Convinces Trump To Reverse Soleimani Killing,1
1686,Biden Asks Advisors How Much Longer He Has To Pretend To Be Confused And Doddering To Avoid Criticism,1
1687,Pros And Cons Of Economic Sanctions,1
1688,CNN Reminds Debate Participants To Keep Personal Attacks Off The Stage In Favor Of New Confession Cam Backstage,1
1689,CNN Moderator Challenges Sanders’ Support For Women By Asking Him To Name Every Part Of Female Reproductive System,1
1690,"‘Hey, Remember John Hickenlooper?’ Says Wolf Blitzer To Break Tension From Debate",1
1691,CNN Figures It Can Soak Tom Steyer For Couple Million By Pretending It Costs Money To Appear In Debate,1
1692,Democratic Candidates Immediately Descend Into Violent Pandemonium Without Cory Booker’s Message Of Love,1
1693,Swing Voter Really Relates To Buttigieg’s Complete Lack Of Conviction,1
1694,Trump Warns Iran Not To Kill Any Protesters Who U.S. Already Has Dibs On,1
1695,Prominent Evangelical Magazine Calls For Removing Trump From Holy Trinity,1
1696,DNC Bows To Pressure By Adding Andrew Cuomo To Increase Ethnic Representation On Debate Stage,1
1697,DNC Eases Debate Requirements To 0.1% Above Whatever Cory Booker Polling,1
1698,Trump Claims He Knows John Dingell Is In Hell Because He Sees Window Into Terrifying Inferno Every Time He Closes His Eyes,1
1699,GOP Turns Dozens Of House Democrats Away From Impeachment For Failing To Provide Adequate Voter ID,1
1700,Congressman Could’ve Sworn Last Impeachment Was Catered,1
1701,Poll Finds 54% Of Americans Approve Executing Trump But Leaving Him In Office,1
1702,Congress Reaches $1.4 Trillion Spending Deal To Award Entire Budget To One Lucky American,1
1703,‘And Then Those 12 People Send It To 12 People—That’s 144 People!” Says Cory Booker Describing Campaign Newsletter Strategy To Rosario Dawson,1
1704,"‘Well Spoken, My Good Fellow, But Let Me Retort,’ Says Congressman Engaged In Probing, High-Minded Debate On Facts And Merits Of Impeachment",1
1705,Fox News Condemns 2020 Election As Partisan Witch Hunt Orchestrated By Democrats To Unseat President,1
1706,Pros And Cons Of Social Media Banning Political Ads,1
1707,So-Called Ronald Reagan Presidential Library Looks Nothing Like Him,1
1708,Pete Buttigieg Blames Inability To Disclose Political Stances On NDA With Buttigieg Campaign,1
1709,Sonny Perdue Argues Food Stamp Cuts Will Incentivize People To Get Exploitative Jobs That Won’t Exist In 5 Years,1
1710,Boris Johnson Worried Anti-Semitism Accusations Against Labour Party Will Hurt Tories’ Hold On Bigot Vote,1
1711,Jimmy Carter Devotes Rest Of Life To Raising Awareness Of Fact That Men Get UTIs Too,1
1712,"Jilted Trump Announces Formation Of Cooler, Way More Powerful NATO With His New Best Friends Oman, Macedonia, And Suriname",1
1713,Pros And Cons Of Talking Politics At Work,1
1714,One-Eyed Man Who Kamala Harris Locked Up 25 Years Ago Quietly Removes Tulsi Gabbard Mask,1
1715,Kamala Harris Supporter Insists Her Inspiring Message Of Something Or Other Will Always Live On,1
1716,"Michael Bloomberg Treats Self To Second, Flashier Presidential Campaign",1
1717,Nation Calls For Letting Biden Rub Women’s Shoulders Again After Seeing What He’ll Do Instead,1
1718,DNC Server Celebrates Escape From U.S. Jurisdiction Surrounded By Bikini-Clad Women On Yacht In Black Sea,1
1719,"‘I Yield The Remainder Of My Time To You, The Viewer At Home,’ Says Adam Schiff During Impeachment Hearing Before Staring Into Camera For 3 Minutes",1
1720,Biggest Revelations From The Anonymous Trump Official’s New Book,1
1721,Buttigieg Campaign Appeals To Moderate Republicans By Touting Low Approval Among Black Voters,1
1722,How Political Ads Are Made,1
1723,Yovanovitch Testifies That She Was Removed To Make Way For Corrupt Back Channel But Gets If No One Cares About Anything Anymore,1
1724,Full Trump Transcript Includes 37 Pages Of Confused President Mashing Fingers Against Dial Pad While Ukrainian President Tries To Speak,1
1725,‘Washington Post’ Impeachment Critic Gives Insipid Day One Inquiry 2 Out Of 5 Andrew Johnsons,1
1726,"Deval Patrick Acquires High Favorability Numbers, Good Iowa Polling After Leveraged Buyout Of Buttigieg Campaign",1
1727,Sean Spicer Takes Job In Trump Administration To Help Public Forget Humiliating ‘Dancing With The Stars’ Tenure,1
1728,Tips For Testifying Before Congress,1
1729,Jim Jordan Condemns Richard Strauss For Masturbating Right Before Big Match,1
1730,Republicans Demand Whistleblower Reveal Their Identity In A Wide Open Field Where There’s A Clear Shot,1
1731,Timeline Of U.S.–Syria Relations,1
1732,MSNBC Poll Finds Support For Bernie Sanders Has Plummeted 2 Points Up,1
1733,Poll Shows Support For Impeachment Weakest Among Uncontacted Amazonian Tribes Who Know Nothing Of Our Ways,1
1734,"‘Hey You, Want To Be A Federal Judge?’ Says Mitch McConnell Pointing To Valet In Heritage Foundation Parking Lot",1
1735,"‘Oh Jesus, Now What?’ Says Exhausted Trump Turning On News To See What Bullshit Thing President Did Today",1
1736,Vindman Says Ukraine Transcript Left Out Lengthy Sections Of Trump Bragging About Time He Was In Pizza Hut Commercial,1
1737,"Bernie Sanders Holds Secret Campaign Meeting With 15,000 Working-Class Democratic Donors",1
1738,Congress Clears Boeing Of All Wrongdoing After Being Appointed Very Special Junior Pilots,1
1739,"‘Again, Again, Again!’ Exclaims Clapping, Grinning Trump After Sixth Time Watching Abu Bakr Al-Baghdadi Death Video",1
1740,"Trump Mortified After World Series Crowd Starts Booing, Chanting ‘Lock Him Up’ At Melania",1
1741,Tim Ryan’s Wife Puts On Strained Smile As Former Candidate Spends Dinner Speculating On Whose VP He’ll Be,1
1742,Sympathetic Representatives Let Lindsey Graham Into Impeachment Hearing After It Becomes Clear He Came To Disrupt It Alone,1
1743,"Republicans Storm National Statuary Hall, Demand To Be Allowed Into Elijah Cummings’ Casket",1
1744,Trump Apologizes For Impeachment Comment After Learning Disturbing History Of 1918 Lynching Of German American Immigrant Robert Prager,1
1745,Jimmy Carter Forced To Remove Dozens Of Genital Piercings Before Entering MRI Machine,1
1746,Assad Starting To Feel Like Friendship With Tulsi Gabbard One-Sided After She Calls Just To Complain About The Election Again,1
1747,Pete Buttigieg Tries Appealing To Moderate Boomers By Announcing He Doesn’t Agree With His Choice To Be Gay But Respects His Decision,1
1748,Trump Supporter Comes Away From Democratic Debate With Pretty Clear Idea Of Which Candidate He’s Going To Kill,1
1749,Pros And Cons Of Whistleblowing,1
1750,Bernie Sanders Renounces Call For Economic Equality After Brush With Death Teaches Him Money Isn’t Everything,1
1751,CNN Moderator Desk Crowded After 16 Pundits Qualify For Debate,1
1752,Hunter Biden Admits It Was Poor Judgment To Be Involved With Corrupt Biden Family,1
1753,Trump Flees Government Oppression By Relocating Administration To Remote Cabin Compound In Mountains Of Idaho,1
1754,Timeline Of The GOP’s Relationship With Trump,1
1755,Despondent Trump Drives Golf Cart Into Water Hazard,1
1756,"‘At Least They Don’t Know About My Leaking, Prolapsed Anus,’ Thinks Devin Nunes Filing Lawsuit Against Mocking Twitter Accounts",1
1757,Trump Assures Kurds There Will One Day Be Very Nice Tree Planted In D.C. Commemorating Their Deaths,1
1758,Trump Cabinet Officials Resentful Of Increasing Power Wielded By Live-In Caregiver,1
1759,Trump Furiously Searching Raytheon Catalog For Gift After Realizing He Promised China And Ukraine Same Javelin Missile,1
1760,"Giuliani: ‘When The Going Gets Tough, I Can Always Look Back Fondly On The Events Of 9/11’",1
1761,Kamala Harris Undergoes Heart Surgery After Seeing Positive Reception For Sanders,1
1762,Justin Trudeau Explains Deep Spiritual Significance Of Oil Pipelines Through Indigenous Lands,1
1763,"Pompeo Clarifies Anyone In Country Can Listen In On Trump Administration Calls By Picking Up Phone, Dialing 9",1
1764,Sanders Attributes Recovery To Thousands Of Small Blood Donations,1
1765,Bernie Sanders Unveils Plan To Tackle Income Inequality With Art Heist From Billionaire’s Home,1
1766,Trump Aides Investigating Whistleblower Struggling To Identify Single Person In CIA With Moral Principles,1
1767,Slide-Whistleblower Complaint Reveals Trump’s Pants Around Ankles,1
1768,Lindsey Graham Demands To Know How Trump Supposed To Lead Nation Under Such Rampant Accountability,1
1769,"Chelsea Manning, Reality Winner Excitedly Hoping Nation’s Newfound Approval Of Whistleblowers Will Get Them Out Of Jail",1
1770,Resistance Democrat Racking Brain For Way To Sexualize Anonymous Whistleblower,1
1771,White House Unveils Lightly Edited Memorandum Of U.S. Constitution That Specifically Declares Trump’s Innocence,1
1772,Beto O’Rourke’s Son Concerned Trump Will Order Ukraine To Investigate Him Next,1
1773,House Democrats Issue Condemnation Of Ukraine For Making It Harder To Avoid Impeaching Trump,1
1774,Justin Trudeau Responds To Blackface Criticism With New ‘Triggered?’ Campaign Slogan,1
1775,Pompeo To Increase Bombing In Afghanistan After Figuring They’ll Miss And Hit Iran At Some Point,1
1776,Mike Pompeo Appears With Families Of Lost Saudi Oil To Call For Justice,1
1777,Trump Confirms That It Was Iran Or Some Country Like That Behind Saudi Oil Attacks,1
1778,John Bolton Asked To Leave Condo Board Meeting After Repeatedly Advocating Bombing Isaacsons,1
1779,Highlights Of The Third Democratic Debate,1
1780,Moderator Jorge Ramos Asks Candidates How They Would Help Struggling Media Companies With $7.5 Billion Of Debt,1
1781,Biden Complains Moderators Keep Giving Him Ample Time To Speak,1
1782,House Democrats Vow To Hold President Accountable With Agriculture Bill Where First Letter Of Every Line Spells Out ‘Impeach Trump’,1
1783,Ex-CIA Agent Valerie Plame Releases Campaign Video Depicting Her Torturing Voters,1
1784,John Bolton Consoles Self That At Least He Didn’t Help To Make World Safer Place,1
1785,America Ends Negotiations With Bloodthirsty Warlord: A Look Back At John Bolton's Time In The Trump Administration,1
1786,Trump Inadvertently Saves Life Of Yemeni Family After Appropriating Pentagon Money For Border Wall,1
1787,Marianne Williamson Deletes Tweets About Using Mind To Control Weather After Realizing Nation Unprepared To Wield Such Great Power,1
1788,How 2020 Presidential Candidates Can Raise Their Polling Numbers,1
1789,Biden Declares Self Only Candidate Who Can Defeat George Bush In 1988 Election,1
1790,Newly Founded Steyer Institute For Political Research Poll Finds Tom Steyer Leading 2020 Democrats At 95%,1
1791,Confused Biden Tells Rambling Anecdote About Working-Class Single Hammer,1
1792,Aides Struggle To Stop Dozens Of Kerosene-Soaked Republicans From Lighting Selves Ablaze Atop David Koch’s Body,1
1793,Struggling Hickenlooper Drops Out Of Colorado Senate Race To Run For Jefferson County Commissioner,1
1794,Tyson Foods Sends Cease-And-Desist To Trump For Using Slaughterhouse Recordings As Pump-Up Anthem At Rallies,1
1795,Trump Attempts To Ease Tensions With Jewish Community By Noting He Also Would've Murdered Christ,1
1796,Jill Biden Urges Democratic Voters To Ignore Which Candidates Are Mentally Sharp Enough To Finish Complete Sentences For Good Of Party,1
1797,"‘And Then There Were 23,’ Says Wayne Messam Crossing Out Hickenlooper Photo In Elaborate Grid Of Rivals",1
1798,Democratic Party: Moving Left Vs. Remaining Moderate,1
1799,Pete Buttigieg Charms Crowd At Iowa Truck Stop By Sampling Local Meth,1
1800,Seth Moulton Spends Afternoon By Radio To See If They Play Campaign Ad,1
1801,Rod Blagojevich Trying To Sell Presidential Commutation To Cellmate For $2.8 Million,1
1802,John Hickenlooper Drops Out Of 2020 Presidential Race One Assumes,1
1803,John Delaney Sends Fundraising Email To Wife Asking To Use More Of Their Money On His Campaign,1
1804,John Delaney Warns Universal Healthcare Not As Feasible As Just Letting Lots Of People Die,1
1805,A Timeline Of U.S.–Iran Relations,1
